,_id,text,tags,definitions,technical_instruction_for_dev,sap_products,content_relevant_to_technical_risks,cost_information,risk_for_gl,support_information,marked,is_priority_statement,user_id
312,5e94e5dbe55dd0f9169ca628,"TO THE MAXIMUM EXTENT PERMITTED BY APPLICABLE LAW, WE WILL HAVE NO LIABILITY FOR ANY MATTER DIRECTLY OR INDIRECTLY RELATING TO THE CREATION, MAINTENANCE, OR OPERATION OF YOUR SITE OR YOUR VIOLATION OF THIS AGREEMENT (INCLUDING ANY PROGRAM POLICY), AND YOU AGREE TO DEFEND, INDEMNIFY, AND HOLD US, OUR AFFILIATES AND LICENSORS, AND OUR AND THEIR RESPECTIVE EMPLOYEES, OFFICERS, DIRECTORS, AND REPRESENTATIVES, HARMLESS FROM AND AGAINST ALL CLAIMS, DAMAGES, LOSSES, LIABILITIES, COSTS, AND EXPENSES (INCLUDING ATTORNEYS’ FEES) RELATING TO (A) YOUR SITE OR ANY MATERIALS THAT APPEAR ON YOUR SITE, INCLUDING THE COMBINATION OF YOUR SITE OR THOSE MATERIALS WITH OTHER APPLICATIONS, CONTENT, OR PROCESSES, (B) THE USE, DEVELOPMENT, DESIGN, MANUFACTURE, PRODUCTION, ADVERTISING, PROMOTION, OR MARKETING OF YOUR SITE OR ANY MATERIALS THAT APPEAR ON OR WITHIN YOUR SITE, (C) YOUR USE OF ANY CONTENT, WHETHER OR NOT SUCH USE IS AUTHORIZED BY OR VIOLATES THIS AGREEMENT OR APPLICABLE LAW, (D) YOUR VIOLATION OF ANY TERM OR CONDITION OF THIS AGREEMENT (INCLUDING ANY PROGRAM POLICY), OR (E) YOUR OR YOUR EMPLOYEES' OR CONTRACTORS’ NEGLIGENCE OR WILLFUL MISCONDUCT.","['liability', 'indemnification']",0,0,0,0,0,0,0,1.0,1.0,I831094
313,5e94e5dbe55dd0f9169ca629,"By accepting this Agreement, you hereby consent to us: (a) sending you emails relating to the Associates Program from time to time, (b) monitoring, recording, using, and disclosing information about your Site and users of your Site that we obtain in connection with your display of Special Links and Content (for example, that a particular Amazon customer clicked through a Special Link from your Site before buying a Product on the Amazon Site) in accordance with the Amazon.com Privacy Notice , (c) reviewing, monitoring, crawling, and otherwise investigating your Site to verify compliance with this Agreement, and (d) using, reproducing, distributing, and displaying your implementation of Content displayed on your Site as examples of best practices in our educational materials.","['consent', 'privacy/data protection', 'informed consent']",0,0,0,0,0,0,0,1.0,1.0,I831094
314,5e94e5dbe55dd0f9169ca62a,"You acknowledge and agree that (a) we and our affiliates may at any time (directly or indirectly) solicit traffic on terms that may differ from those contained in this Agreement, (b) we and our affiliates may at any time (directly or indirectly) operate sites or applications that are similar to or compete with your Site, (c) our failure to enforce your strict performance of any provision of this Agreement will not constitute a waiver of our right to subsequently enforce such provision or any other provision of this Agreement, and (d) any determinations or updates that may be made by us, any actions that may be taken by us, and any approvals that may be given by us under this Agreement can be made, taken, or given in our sole discretion and are only effective if provided in writing by our authorized representative.","['waiver', 'general requirements', 'changes to terms']",0,0,0,0,0,1,0,1.0,1.0,I831094
315,5e94e5dbe55dd0f9169ca62b,"This Agreement incorporates, and you agree to comply with, the most up-to-date version of all policies, appendices, specifications, guidelines, schedules, and other rules referenced in this Agreement or accessible on the Associates Site (“ Program Policies”), including any updates of the Program Policies from time to time. In the event of any conflict between this Agreement and any Program Policy, this Agreement will control. In the event of a conflict between this agreement and your agreement with an Amazon affiliate under a separate affiliate marketing program that agreement will control with respect to such separate program. This Agreement (including the Program Policies) is the entire agreement between you and us regarding the Associates Program and supersedes all prior agreements and discussions.",['general requirements'],1,0,0,0,0,0,0,1.0,1.0,I831094
316,5e94e5dbe55dd0f9169ca62c,"We reserve the right to modify any of the terms and conditions contained in this Agreement (including those in any Program Policy) at any time and in our sole discretion by posting a change notice, revised Agreement, or revised Program Policy on the Associates Site or by sending notice of such modification to you by email to the primary email address then-currently associated with your Associates account (any such change by email will be effective on the date specified in such email but will in no event be less than two business days after the date the email is sent). YOUR CONTINUED PARTICIPATION IN THE ASSOCIATES PROGRAM FOLLOWING THE EFFECTIVE DATE OF SUCH NOTICE WILL CONSTITUTE YOUR ACCEPTANCE OF THE MODIFICATIONS. IF ANY MODIFICATION IS UNACCEPTABLE TO YOU, YOUR ONLY RECOURSE IS TO TERMINATE THIS AGREEMENT IN ACCORDANCE WITH SECTION 6.","['changes to terms', 'termination/suspension']",0,0,0,0,0,0,0,0.0,1.0,
317,5e94e5dbe55dd0f9169ca62d,"1.2      From Customer to ArcTouch. By submitting, posting, generating or displaying any App and/or Customer Data on or through the Service, Customer gives ArcTouch a worldwide, non-sublicensable, non-transferable, non-exclusive, terminable, limited license to reproduce, adapt, modify, translate, publish, perform, display and distribute any App and/or Customer Data for the sole purpose of enabling ArcTouch to provide Customer and End Users with the Service in accordance with the Agreement.","['consent', 'informed consent', 'data security standards', 'data management and usage']",0,0,0,0,0,1,0,1.0,1.0,I831094
318,5e94e5dbe55dd0f9169ca62e,"2.2      Facilities and Data Transfer. All facilities used to store and process an App and Customer Data will adhere to reasonable security standards no less protective than the security standards at facilities where ArcTouch processes and stores its own information of a similar type. ArcTouch has implemented at least industry standard systems and procedures to ensure the security and confidentiality of an App and Customer Data, protect against anticipated threats or hazards to the security or integrity of an App and Customer Data, and protect against unauthorized access to or use of an App and Customer Content. ArcTouch may process and store an App and Customer Data in the United States or any other country in which ArcTouch or its agents maintain facilities. By using the Service, Customer consents to this processing and storage of an App and Customer Data. The parties agree that ArcTouch is merely a data processor.","['data security standards', 'data management and usage']",0,0,0,0,0,0,0,1.0,1.0,I831094
319,5e94e5dbe55dd0f9169ca62f,"2.4      Privacy Policies. The Service is subject to ArcTouch’s Privacy Policy, and is incorporated in this Agreement by reference. Changes to the Privacy Policy will be made as stated in the policy. In addition, ArcTouch is enrolled in the U.S. Department of Commerce Safe Harbor Program and will remain enrolled in this program throughout the Term of the Agreement.",['privacy/data protection'],0,0,0,0,0,0,0,0.0,1.0,
320,5e94e5dbe55dd0f9169ca630,"2.5      New Offerings. ArcTouch may make new offerings, services, tools, features or functionality available from time to time through the Service, the use of which may be contingent upon Customer’s agreement to additional terms.","['changes to service', 'changes to terms']",0,0,0,0,0,1,0,1.0,1.0,I831094
321,5e94e5dbe55dd0f9169ca631,"•      To the Service. Subject to Section 9.4 (Termination for Convenience), ArcTouch may make commercially reasonable Updates to the Service from time to time. If ArcTouch makes a material change to the Service, ArcTouch will inform Customer.",['changes to service'],0,0,0,0,0,0,0,1.0,1.0,I831094
322,5e94e5dbe55dd0f9169ca632,"•      To the Agreement. ArcTouch may make changes to this Agreement, including pricing from time to time. In the event of a material change, Customer may accept the new terms by signing the Agreement, or by clicking an ""I Accept"" button on the web page of the Service that shows this Agreement, or by using the AppGlu Service in a commercial capacity or by distributing any App to End Users. Alternatively, the Customer may terminate the Agreement under Section 9.4 (Termination for Convenience).  Changes are effective on the date ArcTouch notifies the customer of the new Agreement.","['changes to terms', 'payment']",0,0,0,0,1,0,0,1.0,1.0,I831094
323,5e94e5dbe55dd0f9169ca633,3.1      Free Trial Period. The Service is provided to Customer without charge for the first thirty (30) days following the initial creation of each App.,['payment'],0,0,0,0,1,0,0,0.0,1.0,
324,5e94e5dbe55dd0f9169ca634,3.2      Fee Schedule and Invoice. The Service is provided to Customer per a separate Fee Schedule as defined by the Customer’s Invoice. The Fee Schedule shall become a part of this Agreement.,['payment'],0,0,0,0,1,0,0,1.0,1.0,I831094
325,5e94e5dbe55dd0f9169ca635,"3.3      Online Billing. ArcTouch will issue an electronic bill to Customer for all charges accrued after the Free Threshold has been surpassed. Fees are solely based on ArcTouch’s measurements of Customer’s use of the Service, may include monthly fees, and ArcTouch’s determination is final. Customer shall be responsible for all Fees up to the amount set in the Account and shall pay all Fees in U.S. Dollars or in such other currency as agreed to in writing by the parties. Customer shall pay all Fees in accordance with the payment terms in effect.","['payment', 'obligations', 'usage limits']",0,0,0,0,1,0,0,1.0,1.0,I831094
326,5e94e5dbe55dd0f9169ca636,"3.4      Delinquent Payments. Late payments may bear interest at the rate of 1.5% per month (or the highest rate permitted by law, if less). ArcTouch reserves the right to suspend your Account for any late payments.","['payment', 'termination/suspension']",0,0,0,0,1,0,0,1.0,1.0,I831094
327,5e94e5dbe55dd0f9169ca637,"3.5      Taxes. Customer is responsible for any Taxes, and Customer will pay ArcTouch for the Services without any reduction for Taxes. If ArcTouch is obligated to collect or pay Taxes, the Taxes will be invoiced to Customer, unless Customer provides ArcTouch with a timely and valid tax exemption certificate authorized by the appropriate taxing authority. In some states the sales tax is due on the total purchase price at the time of sale and must be invoiced and collected at the time of the sale. If Customer is required by law to withhold any Taxes from its payments to ArcTouch, Customer must provide ArcTouch with an official tax receipt or other appropriate documentation to support such withholding payments.",['payment'],0,0,0,0,1,0,0,1.0,1.0,I831094
328,5e94e5dbe55dd0f9169ca638,"3.6      Invoice Disputes & Refunds. To the fullest extent permitted by law, Customer waives all claims relating to Fees unless claimed within sixty days after charged (this does not affect any Customer rights with its credit card issuer). Refunds (if any) are at the discretion of ArcTouch and will only be in the form of credit for the Service. Nothing in this Agreement obligates ArcTouch to extend credit to any party.",['payment'],0,0,0,0,1,0,0,0.0,1.0,
329,5e94e5dbe55dd0f9169ca639,"4.1      Compliance. Customer is solely responsible for its Apps and Customer Data, and for making sure its Apps or Customer Data comply with the Acceptable Use Policy. ArcTouch reserves the right to review the App or Customer Data to ensure Customer’s compliance with the Acceptable Use Policy. Customer is responsible for ensuring all End Users comply with Customer’s obligations under the Agreement.","['obligations', 'monitor/audit']",0,0,0,0,1,0,0,0.0,1.0,
330,5e94e5dbe55dd0f9169ca63a,"4.2      Privacy. Customer will protect the privacy and legal rights of its End Users under all applicable laws and regulations, which includes a legally adequate privacy notice communicated from Customer. Customer may have the ability to access, monitor, use, or disclose Customer Data submitted by End Users through the Service. Customer will obtain and maintain any required consents from End Users to allow Customer’s access, monitoring, use and disclosure of Customer Data. Further, Customer will notify its End Users that any Customer Data provided as part of the Service will be made available to a third party as part of ArcTouch providing the Service.","['publication risk', 'consent']",0,0,0,0,0,0,0,0.0,1.0,
331,5e94e5dbe55dd0f9169ca63b,4.5      Documentation. ArcTouch may provide Documentation for Customer’s use of the Service. The Documentation may specify restrictions on how the Apps may be built or the Service may be used and Customer agrees to comply with any such restrictions specified.,['general requirements'],0,0,0,0,0,0,0,0.0,1.0,
332,5e94e5dbe55dd0f9169ca63c,"5.1      Suspension/Removals. If Customer becomes aware that any App or an End User’s use of an App, or Customer Data violates the Acceptable Use Policy, Customer will immediately suspend the App, remove the applicable Customer Data, or suspend access to an End User (as may be applicable). If Customer fails to suspend or remove as noted in the prior sentence, ArcTouch may specifically request that Customer do so. If Customer fails to comply with ArcTouch’s request to do so within twenty-four hours, then ArcTouch may suspend AppGlu accounts of the applicable End Users, disable the App, and/or disable the Account (as may be applicable) until such violation is corrected.","['termination/suspension', 'privacy/data protection']",0,0,0,0,0,1,0,1.0,1.0,I831094
333,5e94e5dbe55dd0f9169ca63d,"5.2      Emergency Security Issues. Despite the foregoing, if there is an Emergency Security Issue, then ArcTouch may automatically suspend the offending End User account, App or the Account. Suspension will be to the minimum extent required, and of the minimum duration, to prevent or terminate the Emergency Security Issue. If ArcTouch suspends an End User account or the App or Account, for any reason, without prior notice to Customer, at Customer’s request, ArcTouch will provide Customer the reason for the suspension as soon as is reasonably possible.",['termination/suspension'],0,0,0,0,0,0,0,0.0,1.0,
334,5e94e5dbe55dd0f9169ca63e,"7.2      Deprecation Policy.  ArcTouch will announce if we intend to discontinue or make backwards-incompatible changes to this API or Service. We will use commercially reasonable efforts to continue to operate that Service without these changes until one year after the announcement,unless (as ArcTouch determines in its reasonable good faith judgment):",['changes to service'],0,0,0,0,0,1,0,1.0,1.0,I831094
335,5e94e5dbe55dd0f9169ca63f,"9.1      Agreement Term. The license granted in this Agreement will remain in effect, unless terminated earlier as set forth in this Agreement.",['termination/suspension'],0,0,0,0,0,0,0,0.0,1.0,
336,5e94e5dbe55dd0f9169ca640,9.2      Termination for Breach. Either party may terminate this Agreement for breach if: (i) the other party is in material breach of the Agreement and fails to cure that breach within thirty days after receipt of written notice; (ii) the other party ceases its business operations or becomes subject to insolvency proceedings and the proceedings are not dismissed within ninety days; or (iii) the other party is in material breach of this Agreement more than two times notwithstanding any cure of such breaches.,['termination/suspension'],0,0,0,0,0,0,0,1.0,1.0,I831094
337,5e94e5dbe55dd0f9169ca641,"9.3      Termination for Inactivity. ArcTouch reserves the right to terminate the Service for inactivity, if, for a period exceeding ninety days, Customer (a) has failed to access the Admin Control Center, (b) an App has not served any requests, and (c) no electronic bills are being generated.",['termination/suspension'],0,0,0,0,0,0,0,0.0,1.0,
338,5e94e5dbe55dd0f9169ca642,"9.4      Termination at Expiration of Free Trial Period. After the expiration of the Free Trial Period, Customer may not use, distribute, or sublicense any Apps. Additionally, Customer may not use the Service to manage such terminated Apps.  ArcTouch may terminate the functionality of any App, and/or the Service for managing such Apps, at any time, without further notice.",['termination/suspension'],0,0,0,0,0,0,0,0.0,1.0,
339,5e94e5dbe55dd0f9169ca643,"9.4      Termination for Convenience. Customer may stop using the Service at any time. Customer may terminate this Agreement for convenience at any time with written notice, and upon termination, must cease use of the Service. ArcTouch may terminate this Agreement for its convenience at any time without liability to Customer. Subject to Section 7.2, ArcTouch may discontinue the Service or any portion or feature for any reason at any time without liability to Customer.",['termination/suspension'],0,0,0,0,0,0,0,1.0,1.0,I831094
340,5e94e5dbe55dd0f9169ca644,"9.5      Effects of Termination. If the Agreement expires or is terminated, then: (i) the rights granted by one party to the other will immediately cease; (ii) all Fees (including Taxes) owed by Customer to ArcTouch are immediately due upon receipt of the final electronic bill; (iii) Customer will delete the Software, any App and any Customer Data; and (iv) upon request, each party will use commercially reasonable efforts to return or destroy all Confidential Information of the other party.",['termination/suspension'],0,0,0,0,0,0,0,0.0,1.0,
341,5e94e5dbe55dd0f9169ca645,"Customer is permitted to state publicly that it is a customer of the Service, consistent with the Trademark Guidelines. Customer agrees that ArcTouch may include Customer’s name or Brand Features in a list of ArcTouch customers, online or promotional materials. Customer also agrees that ArcTouch may verbally reference Customer as a customer of the AppGlu products or services that are the subject of this Agreement. For clarification, neither party needs to seek approval from the other if the party is repeating a public statement that is substantially similar to a public statement that has been previously approved.",['publicity'],0,0,0,0,0,0,0,0.0,1.0,
342,5e94e5dbe55dd0f9169ca646,"Each party represents that: (a) it has full power and authority to enter into the Agreement; and (b) it will comply with all laws and regulations applicable to its provision, or use, of the Service, as applicable. ArcTouch warrants it will provide the Service in accordance with the applicable SLA.",['general requirements'],0,0,0,0,0,0,0,0.0,1.0,
343,5e94e5dbe55dd0f9169ca647,"EXCEPT AS EXPRESSLY PROVIDED FOR HEREIN, TO THE MAXIMUM EXTENT PERMITTED BY APPLICABLE LAW, ARCTOUCH DOES NOT MAKE ANY OTHER WARRANTY OF ANY KIND, WHETHER EXPRESS, IMPLIED, STATUTORY OR OTHERWISE, INCLUDING WITHOUT LIMITATION WARRANTIES OF MERCHANTABILITY, FITNESS FOR A PARTICULAR USE AND NONINFRINGEMENT. ARCTOUCH IS NOT RESPONSIBLE OR LIABLE FOR THE DELETION OF OR FAILURE TO STORE ANY CONTENT AND OTHER COMMUNICATIONS MAINTAINED OR TRANSMITTED THROUGH USE OF THE SERVICE. CUSTOMER IS SOLELY RESPONSIBLE FOR SECURING AND BACKING UP ITS APP AND CUSTOMER CONTENT. ARCTOUCH DOES NOT WARRANT THAT THE OPERATION OF THE SOFTWARE OR THE SERVICE WILL BE ERROR-FREE OR UNINTERRUPTED. NEITHER THE SOFTWARE NOR THE SERVICE ARE DESIGNED, MANUFACTURED, OR INTENDED FOR HIGH RISK ACTIVITIES.","['as-is and as-available', 'liability']",0,0,0,0,0,0,0,0.0,1.0,
344,5e94e5dbe55dd0f9169ca648,"13.1    Limitation on Indirect Liability. TO THE MAXIMUM EXTEND PERMITTED BY APPLICABLE LAW, NEITHER PARTY, NOR ARCTOUCH’S SUPPLIERS, WILL BE LIABLE UNDER THIS AGREEMENT FOR LOST REVENUES OR INDIRECT, SPECIAL, INCIDENTAL, CONSEQUENTIAL, EXEMPLARY, OR PUNITIVE DAMAGES, EVEN IF THE PARTY KNEW OR SHOULD HAVE KNOWN THAT SUCH DAMAGES WERE POSSIBLE AND EVEN IF DIRECT DAMAGES DO NOT SATISFY A REMEDY.","['as-is and as-available', 'liability']",0,0,0,0,0,0,0,0.0,1.0,
345,5e94e5dbe55dd0f9169ca649,"13.2    Limitation on Amount of Liability. TO THE MAXIMUM EXTENT PERMITTED BY APPLICABLE LAW, NEITHER PARTY, NOR ARCTOUCH’S SUPPLIER’S, MAY BE HELD LIABLE UNDER THIS AGREEMENT FOR MORE THAN THE AMOUNT PAID BY CUSTOMER TO ARCTOUCH DURING THE TWELVE MONTHS PRIOR TO THE EVENT GIVING RISE TO LIABILITY.","['liability', 'indemnification']",0,0,0,0,0,0,0,0.0,1.0,
346,5e94e5dbe55dd0f9169ca64a,"13.3    Exceptions to Limitations. These limitations of liability do not apply to breaches of confidentiality obligations, violations of a party’s Intellectual Property Rights by the other party, or indemnification obligations.",['liability'],0,0,0,0,0,0,0,1.0,1.0,I831094
347,5e94e5dbe55dd0f9169ca64b,"14.1    By Customer. Customer will indemnify, defend, and hold harmless ArcTouch from and against all liabilities, damages, and costs (including settlement costs and reasonable attorneys’ fees) arising out of a third party claim: (i) regarding any App or Customer Content; (ii) that Customer Brand Features infringe or misappropriate any patent, copyright, trade secret or trademark of a third party; or (iii) regarding Customer’s, or its End Users’, use of the Service in violation of the Acceptable Use Policy.",['indemnification'],0,0,0,0,0,0,0,0.0,1.0,
348,5e94e5dbe55dd0f9169ca64c,"14.2    By ArcTouch. ArcTouch will indemnify, defend, and hold harmless Customer from and against all liabilities, damages, and costs (including settlement costs and reasonable attorneys’ fees) arising out of a third party claim that ArcTouch’s technology used to provide the Service (excluding any open source software) or any ArcTouch Brand Feature infringes or misappropriates any patent, copyright, trade secret or trademark of such third party. Notwithstanding the foregoing, in no event shall ArcTouch have any obligations or liability under this Section arising from: (i) use of any Service or ArcTouch Brand Features in a modified form or in combination with materials not furnished by ArcTouch, and (ii) any Customer Content.",['indemnification'],0,0,0,0,0,0,0,1.0,1.0,I831094
349,5e94e5dbe55dd0f9169ca64d,"a.    Repair, Replace, or Modify. If ArcTouch reasonably believes the Service infringes a third party’s Intellectual Property Rights, then ArcTouch will: (a) obtain the right for Customer, at ArcTouch’s expense, to continue using the Service; (b) provide a non-infringing functionally equivalent replacement; or (c) modify the Service so that it no longer infringes.",['changes to service'],0,0,0,0,0,0,0,0.0,1.0,
350,5e94e5dbe55dd0f9169ca64e,"b.    Suspension or Termination. If ArcTouch does not believe the foregoing options are commercially reasonable, then ArcTouch may suspend or terminate Customer’s use of the impacted Service.",['termination/suspension'],0,0,0,0,0,0,0,0.0,1.0,
351,5e94e5dbe55dd0f9169ca64f,"14.4    General. As a condition to indemnification for a claim, the party seeking indemnification must promptly notify the other party of the claim in writing and cooperate with the other party in defending the claim. The indemnifying party has full control and authority over the defense, except that: (a) any settlement requiring the party seeking indemnification to admit liability or to pay any money will require that party’s prior written consent, such consent not to be unreasonably withheld or delayed; and (b) the other party may join in the defense with its own counsel at its own expense. Notwithstanding the foregoing, if the indemnified party settles without the prior written consent of the indemnifying party, the indemnifying party has no obligation of contribution. THE INDEMNITIES ABOVE ARE THE ONLY REMEDY UNDER THIS AGREEMENT FOR VIOLATION OF A THIRD PARTY’S INTELLECTUAL PROPERTY RIGHTS.",['indemnification'],0,0,0,0,0,0,0,0.0,1.0,
352,5e94e5dbe55dd0f9169ca650,"16.3    Change of Control. If a party experiences a change of Control (for example, through a stock purchase or sale, merger, or other form of corporate transaction): (a) that party will give written notice to the other party within thirty days after the change of Control; and (b) the other party may immediately terminate this Agreement any time between the change of Control and thirty days after it receives that written notice.",['termination/suspension'],0,0,0,0,0,0,0,0.0,1.0,
353,5e94e5dbe55dd0f9169ca651,"16.5    No Agency. This Agreement does not create any agency, partnership or joint venture between the parties.",['general requirements'],0,0,0,0,0,0,0,0.0,1.0,
354,5e94e5dbe55dd0f9169ca652,"•      For City, County, and State Government Entities. If Customer is a city, county or state government entity, then the parties agree to remain silent regarding governing law and venue.",['general requirements'],0,0,0,0,0,0,0,0.0,1.0,
355,5e94e5dbe55dd0f9169ca653,"16.11  Amendments. Any amendment must be in writing, signed by both parties, and expressly state that it is amending this Agreement.",['changes to terms'],0,0,0,0,0,0,0,1.0,1.0,I831094
356,5e94e5dbe55dd0f9169ca654,"16.12  Survival. The following Sections will survive expiration or termination of this Agreement: 6.1 (Intellectual Property Rights), 8 (Confidential Information), 9.5 (Effects of Termination), 13 (Limitation of Liability), 14 (Indemnification) and 16 (Miscellaneous).",['termination/suspension'],0,0,0,0,0,0,0,0.0,1.0,
357,5e94e5dbe55dd0f9169ca655,Capitalized terms have the meaning stated in the applicable agreement between Customer and ArcTouch.,['general requirements'],0,0,0,0,0,0,0,0.0,1.0,
