,_id,text,tags,definitions,technical_instruction_for_dev,sap_products,content_relevant_to_technical_risks,cost_information,risk_for_gl,support_information,marked,is_priority_statement,user_id
0,5e94e5dbe55dd0f9169ca4f0,"You will only access (or attempt to access) an API by the means described in the documentation of that API. If Google assigns you developer credentials (e.g. client IDs), you must use them with the applicable APIs. You will not misrepresent or mask either your identity or your API Client's identity when using the APIs or developer accounts.",['technical requirements'],0,1,0,1,0,0,0,1.0,1.0,I831094
1,5e94e5dbe55dd0f9169ca4f1,"Consequently, you will not create an API Client that functions substantially the same as the APIs and offer it for use by third parties",['technical requirements'],0,1,0,1,0,0,0,1.0,1.0,I831094
2,5e94e5dbe55dd0f9169ca4f2,"When you do, we’ll ask for personal information, like your name, email address, telephone number or credit card to store with your account. If you want to take full advantage of the sharing features we offer, we might also ask you to create a publicly visible Google Profile, which may include your name and photo.","['use/modification of sap content', 'monitor/audit']",0,0,0,0,1,0,0,0.0,1.0,
3,5e94e5dbe55dd0f9169ca4f3,"We collect information about the services that you use and how you use them, like when you watch a video on YouTube, visit a website that uses our advertising services or view and interact with our ads and content. This information includes:","['use/modification of sap content', 'monitor/audit']",0,0,0,0,1,0,0,0.0,1.0,
4,5e94e5dbe55dd0f9169ca4f4,"We collect device-specific information (such as your hardware model, operating system version, unique device identifiers, and mobile network information including phone number). Google may associate your device identifiers or phone number with your Google Account.",['monitor/audit'],0,0,0,0,0,0,0,1.0,1.0,I831094
5,5e94e5dbe55dd0f9169ca4f5,"When you use our services or view content provided by Google, we automatically collect and store certain information in server logs.","['monitor/audit', 'data management and usage']",0,0,0,0,0,0,0,1.0,1.0,I831094
6,5e94e5dbe55dd0f9169ca4f6,"When you use Google services, we may collect and process information about your actual location. We use various technologies to determine location, including IP address, GPS and other sensors that may, for example, provide Google with information on nearby devices, Wi-Fi access points and mobile towers.",['monitor/audit'],0,0,0,0,1,0,0,0.0,1.0,
7,5e94e5dbe55dd0f9169ca4f7,"Certain services include a unique application number. This number and information about your installation (for example, the operating system type and application version number) may be sent to Google when you install or uninstall that service or when that service periodically contacts our servers, such as for automatic updates.",['monitor/audit'],0,0,0,0,1,0,0,0.0,1.0,
8,5e94e5dbe55dd0f9169ca4f8,We may collect and store information (including personal information) locally on your device using mechanisms such as browser web storage (including HTML 5) and application data caches.,['monitor/audit'],0,0,0,0,0,1,0,1.0,1.0,I831094
9,5e94e5dbe55dd0f9169ca4f9,"We use information collected from cookies and other technologies, like pixel tags, to improve your user experience and the overall quality of our services. One of the products we use to do this on our own services is Google Analytics. For example, by saving your language preferences, we’ll be able to have our services appear in the language you prefer. When showing you tailored ads, we will not associate an identifier from cookies or similar technologies with sensitive categories, such as those based on race, religion, sexual orientation or health.",['monitor/audit'],0,0,0,0,1,0,0,0.0,1.0,
10,5e94e5dbe55dd0f9169ca4fa,"Microsoft collects data to operate effectively and provide you the best experiences with our products. You provide some of this data directly, such as when you create a Microsoft account, administer your organization’s licensing account, submit a search query to Bing, register for a Microsoft event, speak a voice command to Cortana, upload a document to OneDrive, purchase an MSDN subscription, sign up for Office 365, or contact us for support. We get some of it by recording how you interact with our products by, for example, using technologies like cookies, and receiving error reports or usage data from software running on your device. We also obtain data from third parties.","['monitor/audit', 'privacy/data protection']",0,0,0,0,0,0,0,1.0,1.0,I831094
11,5e94e5dbe55dd0f9169ca4fb,"Microsoft uses the data we collect to operate our business and provide you the products we offer, which includes using data to improve our products and personalize your experiences. We also may use the data to communicate with you, for example, informing you about your account, security updates and product information. And we use data to help show more relevant ads, whether in our own products supported by advertising like MSN and Bing, or in products offered by third parties. However, we do not use what you say in email, chat, video calls or voice mail, or your documents, photos or other personal files to target ads to you.",['monitor/audit'],0,0,0,0,1,0,0,0.0,1.0,
12,5e94e5dbe55dd0f9169ca4fc,"Microsoft uses cookies (small text files placed on your device) and similar technologies to provide our websites and online services and to help collect data. Cookies allow us, among other things, to store your preferences and settings; enable you to sign-in; provide interest-based advertising; combat fraud; and analyze how our websites and online services are performing. Microsoft apps use other identifiers, such as the advertising ID in Windows described in the Windows section of this statement, for similar purposes.","['monitor/audit', 'privacy/data protection']",0,0,0,0,0,0,0,1.0,1.0,I831094
13,5e94e5dbe55dd0f9169ca4fd,"Microsoft reserves the right to update the TOU at any time without notice to you. The most current version of the TOU can be reviewed by clicking on the ""Terms of Use"" hypertext link located at the bottom of our Web pages.",['changes to terms'],1,0,0,0,0,0,0,0.0,1.0,
14,5e94e5dbe55dd0f9169ca4fe,"Unless otherwise specified, the Services are for your personal and non-commercial use. You may not modify, copy, distribute, transmit, display, perform, reproduce, publish, license, create derivative works from, transfer, or sell any information, software, products or services obtained from the Services.","['usage limits', 'payment']",0,0,0,0,1,0,0,0.0,1.0,
15,5e94e5dbe55dd0f9169ca4ff,"MICROSOFT AND/OR ITS RESPECTIVE SUPPLIERS MAKE NO REPRESENTATIONS ABOUT THE SUITABILITY OF THE INFORMATION CONTAINED IN THE DOCUMENTS AND RELATED GRAPHICS PUBLISHED AS PART OF THE SERVICES FOR ANY PURPOSE. ALL SUCH DOCUMENTS AND RELATED GRAPHICS ARE PROVIDED ""AS IS"" WITHOUT WARRANTY OF ANY KIND. MICROSOFT AND/OR ITS RESPECTIVE SUPPLIERS HEREBY DISCLAIM ALL WARRANTIES AND CONDITIONS WITH REGARD TO THIS INFORMATION, INCLUDING ALL WARRANTIES AND CONDITIONS OF MERCHANTABILITY, WHETHER EXPRESS, IMPLIED OR STATUTORY, FITNESS FOR A PARTICULAR PURPOSE, TITLE AND NON-INFRINGEMENT. IN NO EVENT SHALL MICROSOFT AND/OR ITS RESPECTIVE SUPPLIERS BE LIABLE FOR ANY SPECIAL, INDIRECT OR CONSEQUENTIAL DAMAGES OR ANY DAMAGES WHATSOEVER RESULTING FROM LOSS OF USE, DATA OR PROFITS, WHETHER IN AN ACTION OF CONTRACT, NEGLIGENCE OR OTHER TORTIOUS ACTION, ARISING OUT OF OR IN CONNECTION WITH THE USE OR PERFORMANCE OF INFORMATION AVAILABLE FROM THE SERVICES.","['as-is and as-available', 'liability']",0,0,0,0,0,0,0,1.0,1.0,I831094
16,5e94e5dbe55dd0f9169ca500,"By accessing or using the Microsoft Graph API, including within a software application, website, tool, or product you create or a service you offer (your “Application”), you are agreeing to these terms and to comply with any accompanying documentation that applies to your use of the Graph API (“API Terms”) with Microsoft Corporation (“Microsoft”, “we”, “us”, or “our”). You represent and warrant to us that you have the authority to accept these API Terms on behalf of yourself, a company, and/or other entity, as applicable. We may change, amend or terminate these API Terms at any time. Your use of the Graph API after any change or amendment means you agree to the new API Terms. If you do not agree to the new API Terms or if we terminate these API Terms, you must stop using the Graph API.",['technical requirements'],0,1,0,1,0,0,0,0.0,1.0,
17,5e94e5dbe55dd0f9169ca501,"Request from the Graph API more than the minimum amount of data, or more than the minimum permissions to the types of data, that your Application needs for Customers to use the intended functionality of your Application;",['usage limits'],0,0,0,0,1,0,0,0.0,1.0,
18,5e94e5dbe55dd0f9169ca502,"Use Graph API in any manner that works around any technical limitations of the Graph API or of the accessed Microsoft Offering, or reverse engineer, decompile or disassemble the Graph API, except and only to the extent that applicable law expressly permits, despite this limitation;",['usage limits'],0,0,0,0,1,0,0,0.0,1.0,
19,5e94e5dbe55dd0f9169ca503,"Such changes may include, without limitation, removing or limiting access to specific API(s), requiring fees or setting and enforcing limits on your use of additions to the Graph API. We may also impose limits on certain features and services or restrict your access to some or all of the Graph API. We may release subsequent versions of the Graph API and require that you use those subsequent versions, at your sole cost and expense.","['changes to service', 'usage limits', 'termination/suspension']",0,0,0,0,1,0,0,0.0,1.0,
20,5e94e5dbe55dd0f9169ca504,"WE MAKE NO WARRANTIES, EXPRESS OR IMPLIED, GUARANTEES OR CONDITIONS WITH RESPECT TO YOUR USE OF THE GRAPH API. YOU UNDERSTAND THAT USE OF THE GRAPH API IS AT YOUR OWN RISK AND THAT WE PROVIDE THE GRAPH API ON AN “AS IS” BASIS “WITH ALL FAULTS” AND ""AS AVAILABLE."" TO THE EXTENT PERMITTED UNDER YOUR LOCAL LAW, WE EXCLUDE ANY IMPLIED WARRANTIES, INCLUDING FOR MERCHANTABILITY, SATISFACTORY QUALITY, FITNESS FOR A PARTICULAR PURPOSE, WORKMANLIKE EFFORT, AND NON-INFRINGEMENT. YOU MAY HAVE CERTAIN RIGHTS UNDER YOUR LOCAL LAW. NOTHING IN THESE API TERMS ARE INTENDED TO AFFECT THOSE RIGHTS, IF THEY ARE APPLICABLE. WE DO NOT GUARANTEE THE GRAPH API WILL FUNCTION WITHOUT INTERRUPTION OR ERRORS IN FUNCTIONING. IN PARTICULAR, THE OPERATION OF THE GRAPH API MAY BE INTERRUPTED DUE TO MAINTENANCE, UPDATES, OR SYSTEM OR NETWORK FAILURES. WE DISCLAIM ALL LIABILITY FOR DAMAGES CAUSED BY ANY SUCH INTERRUPTION, ERRORS IN FUNCTIONING, OR THAT DATA LOSS WILL NOT OCCUR.",['as-is and as-available'],1,0,0,0,0,0,0,0.0,1.0,
21,5e94e5dbe55dd0f9169ca505,"You agree that by clicking “Join Now”, “Join LinkedIn”, “Sign Up” or similar, registering, accessing or using our services (described below), you are agreeing to enter into a legally binding contract with LinkedIn (even if you are using our Services on behalf of a company). If you do not agree to this contract (“Contract” or “User Agreement”), do not click “Join Now” (or similar) and do not access or otherwise use any of our Services.",[],0,1,0,0,0,0,0,0.0,0.0,
22,5e94e5dbe55dd0f9169ca506,"If you buy any of our paid Services (“Premium Services”), you agree to pay us the applicable fees and taxes and to additional terms specific to the paid Services. ",['payment'],0,0,0,0,1,0,0,1.0,1.0,I831094
23,5e94e5dbe55dd0f9169ca507,Your purchase may be subject to foreign exchange fees or differences in prices based on location (e.g. exchange rates).,['payment'],0,0,0,0,1,0,0,0.0,1.0,
24,5e94e5dbe55dd0f9169ca508,"We may store and continue billing your payment method (e.g. credit card) even after it has expired, to avoid interruptions in your Services and to use to pay other Services you may buy.",['payment'],0,0,0,0,1,0,0,0.0,1.0,
25,5e94e5dbe55dd0f9169ca509,"If you purchase a subscription, your payment method automatically will be charged at the start of each subscription period for the fees and taxes applicable to that period. To avoid future charges, cancel before the renewal date. Learn how to cancel or suspend your Premium Services.",['payment'],0,0,0,0,1,0,0,0.0,1.0,
26,5e94e5dbe55dd0f9169ca50a,All of your purchases of Services are subject to LinkedIn’s refund policy.,['payment'],0,0,0,0,1,0,0,0.0,1.0,
27,5e94e5dbe55dd0f9169ca50b,We may calculate taxes payable by you based on the billing information that you provide us at the time of purchase,['payment'],0,0,0,0,1,0,0,1.0,1.0,I831094
28,5e94e5dbe55dd0f9169ca50c,"As between you and LinkedIn, you own the content and information that you submit or post to the Services and you are only granting LinkedIn and our affiliates the following non-exclusive license: A worldwide, transferable and sublicensable right to use, copy, modify, distribute, publish, and process, information and content that you provide through our Services, without any further consent, notice and/or compensation to you or others.",['use/modification of sap content'],0,0,0,0,0,1,0,1.0,1.0,I831094
29,5e94e5dbe55dd0f9169ca50d,"We will get your consent if we want to give third parties the right to publish your posts beyond the Service. However, other Members and/or Visitors may access and share your content and information, consistent with your choices.",['informed consent'],0,0,0,0,0,0,0,0.0,1.0,
30,5e94e5dbe55dd0f9169ca50e,"Because you own your content and information and we only have non-exclusive rights to it, you may choose to make it available to others, including under the terms of a Creative Commons license.",['use/modification of sap content'],0,0,0,0,0,1,0,1.0,1.0,I831094
31,5e94e5dbe55dd0f9169ca50f,We may change or discontinue any of our Services. We don’t promise to store or keep showing any information and content that you’ve posted.,"['use/modification of sap content', 'changes to service', 'termination/suspension']",0,0,0,0,0,1,0,1.0,1.0,I831094
32,5e94e5dbe55dd0f9169ca510,"LinkedIn is not a storage service. You agree that we have no obligation to store, maintain or provide you a copy of any content or information that you or others provide, except to the extent required by applicable law and as noted in our Privacy Policy.",['use/modification of sap content'],0,0,0,0,0,0,0,0.0,1.0,
33,5e94e5dbe55dd0f9169ca511,"By using the Services, you may encounter content or information that might be inaccurate, incomplete, delayed, misleading, illegal, offensive or otherwise harmful. LinkedIn generally does not review content provided by our Members or others. You agree that we are not responsible for others’ (including other Members’) content or information. We cannot always prevent this misuse of our services, and you agree that we are not responsible for any such misuse. You also acknowledge the risk that you or your organization may be mistakenly associated with content about others when we let connections and followers know you or your organization were mentioned in the news.",['liability'],0,0,0,0,0,0,0,0.0,1.0,
34,5e94e5dbe55dd0f9169ca512,"LinkedIn reserves the right to limit your use of the Services, including the number of your connections and your ability to contact other Members. LinkedIn reserves the right to restrict, suspend, or terminate your account if LinkedIn believes that you may be in breach of this Contract or law or are misusing the Services (e.g. violating any Do and Don’ts).","['changes to service', 'usage limits', 'termination/suspension']",0,0,0,0,1,0,0,0.0,1.0,
35,5e94e5dbe55dd0f9169ca513,"TO THE EXTENT ALLOWED UNDER LAW, LINKEDIN AND ITS AFFILIATES (AND THOSE THAT LINKEDIN WORKS WITH TO PROVIDE THE SERVICES) (A) DISCLAIM ALL IMPLIED WARRANTIES AND REPRESENTATIONS (E.G. WARRANTIES OF MERCHANTABILITY, FITNESS FOR A PARTICULAR PURPOSE, ACCURACY OF DATA, AND NONINFRINGEMENT); (B) DO NOT GUARANTEE THAT THE SERVICES WILL FUNCTION WITHOUT INTERRUPTION OR ERRORS, AND (C) PROVIDE THE SERVICE (INCLUDING CONTENT AND INFORMATION) ON AN “AS IS” AND “AS AVAILABLE” BASIS.",['as-is and as-available'],0,0,0,0,0,0,0,0.0,1.0,
36,5e94e5dbe55dd0f9169ca514,"TO THE EXTENT PERMITTED UNDER LAW (AND UNLESS LINKEDIN HAS ENTERED INTO A SEPARATE WRITTEN AGREEMENT THAT OVERRIDES THIS CONTRACT), LINKEDIN AND ITS AFFILIATES (AND THOSE THAT LINKEDIN WORKS WITH TO PROVIDE THE SERVICES) SHALL NOT BE LIABLE TO YOU OR OTHERS FOR ANY INDIRECT, INCIDENTAL, SPECIAL, CONSEQUENTIAL OR PUNITIVE DAMAGES, OR ANY LOSS OF DATA, OPPORTUNITIES, REPUTATION, PROFITS OR REVENUES, RELATED TO THE SERVICES (E.G. OFFENSIVE OR DEFAMATORY STATEMENTS, DOWN TIME OR LOSS, USE OF, OR CHANGES TO, YOUR INFORMATION OR CONTENT).",['liability'],0,0,0,0,0,0,0,1.0,1.0,I831094
37,5e94e5dbe55dd0f9169ca515,"SOME LAWS DO NOT ALLOW THE LIMITATION OR EXCLUSION OF LIABILITY, SO THESE LIMITS MAY NOT APPLY TO YOU.",['liability'],0,0,0,0,0,0,0,0.0,1.0,
38,5e94e5dbe55dd0f9169ca516,"IN NO EVENT SHALL THE LIABILITY OF LINKEDIN AND ITS AFFILIATES (AND THOSE THAT LINKEDIN WORKS WITH TO PROVIDE THE SERVICES) EXCEED, IN THE AGGREGATE FOR ALL CLAIMS, AN AMOUNT THAT IS THE LESSER OF (A) FIVE TIMES THE MOST RECENT MONTHLY OR YEARLY FEE THAT YOU PAID FOR A PREMIUM SERVICE, IF ANY, OR (B) US $1000.",['liability'],0,0,0,0,0,0,0,0.0,1.0,
39,5e94e5dbe55dd0f9169ca517,"THIS LIMITATION OF LIABILITY IS PART OF THE BASIS OF THE BARGAIN BETWEEN YOU AND LINKEDIN AND SHALL APPLY TO ALL CLAIMS OF LIABILITY (E.G. WARRANTY, TORT, NEGLIGENCE, CONTRACT, LAW) AND EVEN IF LINKEDIN OR ITS AFFILIATES HAS BEEN TOLD OF THE POSSIBILITY OF ANY SUCH DAMAGE, AND EVEN IF THESE REMEDIES FAIL THEIR ESSENTIAL PURPOSE.",['liability'],0,0,0,0,0,0,0,1.0,1.0,I831094
40,5e94e5dbe55dd0f9169ca518,"Both you and LinkedIn may terminate this Contract at any time with notice to the other. On termination, you lose the right to access or use the Services.",['termination/suspension'],0,0,0,0,0,0,0,0.0,1.0,
41,5e94e5dbe55dd0f9169ca519,"We reserve the right to change the terms of this Contract and will provide you notice if we do and we agree that changes cannot be retroactive. If you don't agree to these changes, you must stop using the Services.",['changes to terms'],0,0,0,0,0,0,0,0.0,1.0,
42,5e94e5dbe55dd0f9169ca51a,"Develop, support or use software, devices, scripts, robots, or any other means or processes (including crawlers, browser plugins and add-ons, or any other technology or manual work) to scrape the Services or otherwise copy profiles and other data from the Services;","['usage limits', 'technical requirements']",0,0,0,1,1,0,0,1.0,1.0,I831094
43,5e94e5dbe55dd0f9169ca51b,"Use, disclose or distribute any data obtained in violation of this policy;",['privacy/data protection'],0,0,0,0,0,0,0,0.0,1.0,
44,5e94e5dbe55dd0f9169ca51c,Disclose information that you do not have the consent to disclose (such as confidential information of others (including your employer));,['privacy/data protection'],0,0,0,0,0,0,0,0.0,1.0,
45,5e94e5dbe55dd0f9169ca51d,"Reverse engineer, decompile, disassemble, decipher or otherwise attempt to derive the source code for the Services or any related technology that is not open source;",['technical requirements'],0,1,0,1,0,0,0,1.0,1.0,I831094
46,5e94e5dbe55dd0f9169ca51e,"Monitor the Services’ availability, performance or functionality for any competitive purpose;",['monitor/audit'],0,0,0,0,0,0,0,1.0,1.0,I831094
47,5e94e5dbe55dd0f9169ca51f,"If you use our Services, you consent to the collection, use and sharing of your personal data under this Privacy Policy (which includes our Cookie Policy and other documents referenced in this Privacy Policy) and agree to the User Agreement. We provide you choices that allow you to opt-out or control how we use and share your data.","['use/modification of sap content', 'privacy/data protection', 'informed consent']",0,0,0,0,0,0,0,0.0,1.0,
48,5e94e5dbe55dd0f9169ca520,"We may modify this Privacy Policy, and if we make material changes to it, we will provide notice through our Services, or by other means, to provide you the opportunity to review the changes before they become effective. If you object to any changes, you may close your account. Your continued use of our Services after we publish or send a notice about our changes to this Privacy Policy means that you are consenting to the updated Privacy Policy.","['changes to terms', 'informed consent']",0,0,0,0,0,0,0,1.0,1.0,I831094
49,5e94e5dbe55dd0f9169ca521,"To create an account you provide data including your name, email address and/or mobile number, and a password. If you register for a premium Service, we ask you for payment (e.g., credit card) and billing information.",['payment'],0,0,0,0,1,0,0,0.0,1.0,
50,5e94e5dbe55dd0f9169ca522,"We collect personal data from you when you provide, post or upload it to our Services, such as when you fill out a form, respond to a survey (e.g., Members’ salary), submit a resume and apply for or save jobs or send invitations. If you opt to import your address book, we receive your contacts (including contact information your service provider(s) or app automatically added to your address book when you communicated with addresses or numbers not already in your list). If you sync your email or calendars with our Services, we will collect your “email header” and calendar meeting information (e.g. times, places, attendees and contacts).",['privacy/data protection'],0,0,0,0,0,0,0,0.0,1.0,
51,5e94e5dbe55dd0f9169ca523,"We receive personal data about you when others import or sync their address book or calendar with our Services, or send messages using our Services (including invites or connection requests).",['privacy/data protection'],0,0,0,0,0,1,0,1.0,1.0,I831094
52,5e94e5dbe55dd0f9169ca524,"We receive personal data about you when you use the services of our customers and partners, such as prospective employers and applicant tracking systems providing us job application data.",['data management and usage'],0,0,0,1,0,1,0,0.0,1.0,
53,5e94e5dbe55dd0f9169ca525,"We log usage data when you visit or otherwise use our Services, including our sites, app and platform technology (e.g., our off-site plugins), such as when you view or click on content (e.g., learning video) or ads (on or off our sites and apps), perform a search, install one of our mobile apps, share articles or apply for jobs. We use log-ins, cookies, device information and internet protocol (“IP”) addresses to identify you and log your use.","['monitor/audit', 'data management and usage']",0,0,0,1,1,1,0,0.0,1.0,
54,5e94e5dbe55dd0f9169ca526,"We collect information about you when you send, receive, or engage with messages in connection with our Services. For example, if you get a LinkedIn connection request, we track whether you have acted on it and will send you reminders. We also use automatic scanning technology on messages.","['monitor/audit', 'data management and usage']",0,0,0,0,0,1,0,1.0,1.0,I831094
55,5e94e5dbe55dd0f9169ca527,"Our Services are dynamic and we often introduce new features, which may require the collection of new information. If we collect materially different personal data or materially change how we use your data, we will notify you and may also modify this Privacy Policy.","['changes to terms', 'changes to service']",0,0,0,0,0,0,0,1.0,1.0,I831094
56,5e94e5dbe55dd0f9169ca528,"We sell premium Services that provide our customers customized-search functionality and tools (including messaging and activity alerts) as part of our talent, marketing and sales solutions. These subscribers can export limited information from your profile, such as name, headline, current company, current title, and general location (e.g., Dublin), in order to manage sales leads or talent, unless you opt out. ",['payment'],0,0,0,0,1,0,0,0.0,1.0,
57,5e94e5dbe55dd0f9169ca529,"We use data and content about Members for invitations and communications promoting membership and network growth, engagement and our Services.",['data management and usage'],0,0,0,0,0,1,0,1.0,1.0,I831094
58,5e94e5dbe55dd0f9169ca52a,"We use data, including public feedback, to conduct research and development for the further development of our Services in order to provide you and others with a better, more intuitive and personalized experience, drive membership growth and engagement on our Services, and help connect professionals to each other and to economic opportunity.",['data management and usage'],0,0,0,1,0,1,0,0.0,1.0,
59,5e94e5dbe55dd0f9169ca52b,"We use the data (which can include your communications) needed to investigate, respond to and resolve complaints and Service issues (e.g., bugs).",['data management and usage'],0,0,0,0,0,1,0,1.0,1.0,I831094
60,5e94e5dbe55dd0f9169ca52c,We use your data (including your communications) if we think it’s necessary for security purposes or to investigate possible fraud or other violations of our User Agreement or this Privacy Policy and/or attempts to harm our Members or Visitors.,['data security standards'],0,0,0,0,0,0,0,0.0,1.0,
61,5e94e5dbe55dd0f9169ca52d,"Welcome to the Amazon Web Services site (the “AWS Site”). Amazon Web Services, Inc. and/or its affiliates (“AWS”) provides the AWS Site to you subject to the following terms of use (“Site Terms”). By visiting the AWS Site, you accept the Site Terms. Please read them carefully. In addition, when you use any current or future AWS services, content or other materials, you also will be subject to the AWS Customer Agreement or other agreement governing your use of our services (the “Agreement”).",['technical requirements'],0,1,0,1,0,0,0,0.0,1.0,
