,_id,text,tags,definitions,technical_instruction_for_dev,sap_products,content_relevant_to_technical_risks,cost_information,risk_for_gl,support_information,marked,is_priority_statement,user_id
228,5e94e5dbe55dd0f9169ca5d4,"You understand that all content posted to the Blog (the ""Content"") is the sole responsibility of the individual who originally posted the content. You understand, also, that all opinions expressed by users of this site are expressed strictly in their individual capacities, and not as Our representatives or any of Our sponsors or partners. The opinions that you or others post in the Blog do not necessarily reflect Our opinions.","['indemnification', 'liability']",1,0,0,0,0,0,0,1.0,1.0,I831094
229,5e94e5dbe55dd0f9169ca5d5,Disclaimer of Company Responsibility for Blog Content,['indemnification'],0,0,0,0,0,0,0,0.0,1.0,
230,5e94e5dbe55dd0f9169ca5d6,Any failure by us to enforce or exercise any provision of these Terms of Use or related rights shall not constitute a waiver of that right or provision.,['indemnification'],0,0,0,0,0,0,0,1.0,0.0,I831094
231,5e94e5dbe55dd0f9169ca5d7,"In addition to any excuse provided by applicable law, we shall be excused from liability for non-delivery or delay in delivery of products and services available through our site arising from any event beyond our reasonable control, whether or not foreseeable by either party, including but not limited to, labor disturbance, war, fire, accident, adverse weather, inability to secure transportation, governmental act or regulation, and other causes or events beyond our reasonable control, whether or not similar to those which are enumerated above.",['as-is and as-available'],0,0,0,0,0,0,0,0.0,1.0,
232,5e94e5dbe55dd0f9169ca5d8,"Without limitation, the Site, as well as any content, web pages, software, services, and products operated or provided by Primal are collectively referred to as the “Services“. These Terms of Use may be modified by Primal from time to time in its sole discretion. You are advised to check the Terms of Use frequently for any updates and/or changes which may impact your use.You must accept all of the terms and conditions contained in this Terms of Use agreement and Primal’s Privacy Policy (incorporated by reference) before you may use these Services. By using the Services, you accept these terms. You must discontinue your use of the Services if you do not accept these terms.",['changes to terms'],0,0,0,0,0,0,0,0.0,1.0,
233,5e94e5dbe55dd0f9169ca5d9,"We love that you use our services, but you doing so is your choice. If you choose to use our services, you’re agreeing to follow the terms laid out on this page. Our terms evolve with our services, so check back here as needed for changes.",['changes to terms'],0,0,0,0,0,0,0,1.0,0.0,I831094
234,5e94e5dbe55dd0f9169ca5da,Misuse: You may not misuse the Services. Examples of misuse may include but is not limited to: interfering with the Services or trying to access the Services using a method other than the interface and instructions provided by Primal.,['technical requirements'],0,1,0,1,0,0,0,1.0,1.0,I831094
235,5e94e5dbe55dd0f9169ca5db,"Illegal or Inappropriate Use: Primal may, but is under no obligation to, remove content or refuse to provide Services that Primal determines under its sole discretion as unlawful, offensive, threatening, libelous, defamatory, pornographic, obscene or otherwise objectionable to our Community Standards or violates any party’s intellectual property and/or these Terms of Use, at any time and without prior notice.",[],0,0,0,0,0,0,0,1.0,0.0,I831094
236,5e94e5dbe55dd0f9169ca5dc,"Termination: You agree that Primal may, in its sole discretion, immediately terminate your Primal account and access to the Services without prior notice. You agree that Primal shall not be liable to you nor any third party for any termination of your account or access to the Services. Without limiting the foregoing, Primal will terminate your use of the Services upon:","['termination/suspension', 'liability']",0,0,0,0,0,0,0,1.0,1.0,I831094
237,5e94e5dbe55dd0f9169ca5dd,"Modifications: Primal is constantly changing and improving the Services. Primal may add or remove functionalities or features, and may suspend or stop a Service altogether. You can stop using the Services at any time. Primal may also stop providing Services to you, or add or create new limits to the Services at any time.","['changes to service', 'as-is and as-available']",0,0,0,0,0,0,0,0.0,1.0,
238,5e94e5dbe55dd0f9169ca5de,"We develop services for lawful uses only. Sometimes the law varies with location, so we ask you use our products legally wherever you’re located. Illegal or misuse means we may have to stop providing services to you.",['termination/suspension'],0,0,0,0,0,0,0,0.0,1.0,
239,5e94e5dbe55dd0f9169ca5df, 1.5 System Outages: Primal periodically schedules system downtime for maintenance and other purposes. Unplanned system outages also may occur. Primal will not be liable for any claims or damages arising out of the any interaction with the product including but not limited to:,['as-is and as-available'],0,0,0,0,0,0,0,1.0,1.0,I831094
240,5e94e5dbe55dd0f9169ca5e0,Any third party acts or any other outages of web host providers or the Internet infrastructure and network external to the Services.,['as-is and as-available'],0,0,0,0,0,0,0,1.0,0.0,I831094
241,5e94e5dbe55dd0f9169ca5e1,"Usage Limitations: Primal may limit the number of network calls that you or your application may make, and/or the maximum file size, and/or the maximum content that may be accessed, or anything else about the Services and the content it accesses that Primal deems appropriate in its sole discretion. Primal may change such usage limits at any time and without notice to you. In addition to its other rights under these Terms of Use, Primal may utilize technical measures to prevent overuse and/or stop usage of the API by an application after any usage limitations are exceeded.","['as-is and as-available', 'usage limits']",0,0,0,0,1,0,0,0.0,1.0,
242,5e94e5dbe55dd0f9169ca5e2,"Your experience of our services may change as the product evolves. We also try really hard to maintain the best system possible, but sometimes things break—so you may see an interruption in your services.",['liability'],0,0,0,0,0,0,0,0.0,1.0,
243,5e94e5dbe55dd0f9169ca5e3,"Our system also has only so much capacity, which means we have to limit your use to provide a high level of service for everyone.",['usage limits'],0,0,0,0,1,0,0,0.0,1.0,
244,5e94e5dbe55dd0f9169ca5e4,"1.7 Communications: In connection with your use of the Services, we may send you service announcements, administrative messages, and other information. You may opt out of those communications by sending a message to  support@primal.com .",['consent'],0,0,0,1,0,0,0,0.0,1.0,
245,5e94e5dbe55dd0f9169ca5e5,"We want to give you the best experience possible, so we may send you information that supports our service.","['other', 'consent']",0,0,0,0,0,0,0,1.0,1.0,I831094
246,5e94e5dbe55dd0f9169ca5e6,"Registration: In accordance with these Terms of Use, certain Services may require that you register as a member of the Services (a “Registered Member“) and that you provide information about yourself (such as identification or contact details) as part of the registration process for the Service, or as part of your continued use of the Services. You agree that any registration information you give to Primal will always be accurate, truthful, correct, and up to date.",['privacy/data protection'],0,0,0,0,0,0,0,0.0,1.0,
247,5e94e5dbe55dd0f9169ca5e7,"Passwords: If you are a Registered Member, you are responsible for maintaining the confidentiality of your password and account, and are fully responsible for all activities that occur under your password or account with or without your knowledge. You agree to immediately notify Primal at support@primal.com of any unauthorized use of your password or account or any other breach of security. Primal will not be liable, directly or indirectly, for any loss or damage arising from your failure to comply with this section.",['technical requirements'],0,1,0,0,0,0,1,1.0,1.0,I831094
248,5e94e5dbe55dd0f9169ca5e8,"We know you don’t want your identity stolen, so we make sure account info is accurate. Keeping your password safe helps keep your info safe.",['privacy/data protection'],0,0,0,0,0,0,0,0.0,1.0,
249,5e94e5dbe55dd0f9169ca5e9,Let us know if your password’s compromised or anything looks fishy with your account.,['privacy/data protection'],0,0,0,0,0,0,0,0.0,1.0,
250,5e94e5dbe55dd0f9169ca5ea," 2.3 Age Restriction: The Services are intended for a general audience. However, children under the age of 13 years are not permitted to register as a Registered Member. We may ask for personal information to verify that you are in at least 13 years of age.","['privacy/data protection', 'consent']",0,0,0,0,0,0,0,0.0,1.0,
251,5e94e5dbe55dd0f9169ca5eb,We help you discover content from across the Web. Some of that content might not be appropriate for kids.,['privacy/data protection'],0,0,0,0,0,0,0,1.0,0.0,I831094
252,5e94e5dbe55dd0f9169ca5ec," 2.4 Primal Refund Policy: Our Disclaimer of Warranties, recited in Section 6 of our Terms of Use, applies to our Refund Policy. We make no explicit or implicit warranties. Our Limitation of Liability, recited in Section 7 of our Terms of Use, applies to our Refund Policy. We are not liable to you for any direct or indirect damages (direct or indirect) that result from the use of our Services.If your application directly interacts with Primal, several data plans are made available to you. Your purchase of a data plan is, barring circumstances deemed exigent by Primal, non-refundable. Because we disclaim warranties of any kind when we provide our Services and our Services are provided “as is,” the quality of any goods or services (including the quality of content or data included within the scope of any purchased goods or services) we provide you cannot be the basis for any refund.Your purchase of a data plan provides you with the ability to make a certain number of calls within or the capacity to provision a predetermined number of individual user accounts for a predetermined period (e.g. until the end of the month). If, at the conclusion of this period, you have not made the number of calls or provisioned the number of accounts afforded to you by your plan, i.e. there is a balance of unused purchased calls or provisioned accounts, you shall not be entitled to a refund (prorated or otherwise) on that balance of unused purchased calls.","['liability', 'as-is and as-available', 'payment']",0,0,0,0,1,0,0,1.0,1.0,I831094
253,5e94e5dbe55dd0f9169ca5ed,"Planning for demand is necessary part of any business. If you sign up for a paid API plan, we provision that capacity and that payment is non-refundable. But not to worry —if you oversubscribe one month, just change your plan the next.",['payment'],0,0,0,0,1,0,0,1.0,1.0,I831094
254,5e94e5dbe55dd0f9169ca5ee," 3.3 Derivative Semantic Works: For the purpose of these Terms of Use: “Your Content” means any data that you transmit, distribute, submit, communicate, create, or store on or through the Services (including, without limitation, text, video, pictures, graphics, music, sound clips, likenesses, images, multimedia files, personal information, and other works of authorship). When you provide Your Content to the Services, you acknowledge and agree that there may be an integration, analysis, processing, arrangement, and/or organization of Your Content that results in data, content, or works (other than Your Content), such as text, video, pictures, graphics, music, sound clips, likenesses, images, multimedia files, personal information, and other works of authorship, data, information, arrangements, compilations, techniques, and metadata (“Derivative Semantic Works”). You acknowledge and agree that Primal shall own all right, title, and interest worldwide accrued as a result of creating the l Derivative Semantic Works, including all copyrights and other intellectual property rights therein and all renewals and extensions thereof, in all formats and media, whether now known or hereafter developed, to publish, display, perform, distribute, reproduce, digitize, transmit, translate, or modify a Derivative Semantic Work and any derivative works thereof, for all or any purposes. Data provided to you under one of Primal’s data plans via Primal’s API shall not be governed by this Section 3.3.",['publication risk'],0,0,0,0,0,0,0,0.0,1.0,
255,5e94e5dbe55dd0f9169ca5ef," 3.4 Primal Application Development: You understand and acknowledge that Primal may be independently creating applications, content, and other products or services that may be similar to or competitive with applications you may be developing and any content found therein, and nothing in these Terms of Use will be construed as restricting or preventing Primal from creating and fully exploiting such applications, content, and other items without any obligation to you. If you elect to provide us with any feedback, you hereby assign all right, title, and interest in and to such feedback to us, and acknowledge that we will be entitled to use, implement, and exploit any such feedback in any manner without restriction, and without any obligation of confidentiality, attribution, compensation, or other duty to account.","['privacy/data protection', 'ownership']",0,0,0,0,0,0,0,0.0,1.0,
256,5e94e5dbe55dd0f9169ca5f0,"Privacy: Primal values the privacy of the users of our website. Please see Primal’s  Privacy Policy , incorporated by reference herein, which explains how we treat and protect the information and data of those that use our Services.",['privacy/data protection'],0,0,0,0,0,0,0,0.0,1.0,
257,5e94e5dbe55dd0f9169ca5f1,"You agree to indemnify and hold Primal, its subsidiaries, affiliates, licensors, content providers, service providers, employees, agents, officers, directors, and contractors (the “Indemnified Parties“) harmless from any claim or demand, due to or arising out of your breach of these Terms of Use or the documents incorporated herein by reference, or your violation of any law or the rights of a third party. You agree that the Indemnified Parties will have no liability in connection with any such breach or unauthorized use, and you agree to indemnify any and all resulting loss, damages, judgments, awards, costs, expenses, and reasonable legal fees of the Indemnified Parties in connection therewith. You will also indemnify and hold the Indemnified Parties harmless from and against any claims brought by third parties arising out of your use of the information accessed from the Services.",['indemnification'],0,0,0,0,0,0,0,0.0,1.0,
258,5e94e5dbe55dd0f9169ca5f2,"If you’ve agreed to follow these terms, we ask you to be responsible for our losses caused by failing to follow these terms.",['indemnification'],0,0,0,0,0,0,0,0.0,1.0,
259,5e94e5dbe55dd0f9169ca5f3,"Your use of the Services is at your sole risk. The Services are provided on an “as is” and “as available” basis. Primal and its subsidiaries, affiliates, officers, employees, agents, partners, and licensors expressly disclaim all conditions and warranties of any kind, whether expressed or implied, including, but not limited to the implied warranties of merchantability, fitness for a particular purpose, and non-infringement.",['as-is and as-available'],0,0,0,0,0,0,0,0.0,1.0,
260,5e94e5dbe55dd0f9169ca5f4,"Without limiting the generality of the foregoing, Primal and its subsidiaries, affiliates, officers, employees, agents, partners and licensors make no warranty that:",['as-is and as-available'],0,0,0,0,0,0,0,1.0,1.0,I831094
261,5e94e5dbe55dd0f9169ca5f5,"Information that may be obtained from the use of the Services, and any results of use of the functionality of the Services will be accurate, reliable or complete;",['as-is and as-available'],0,0,0,0,0,0,0,0.0,1.0,
262,5e94e5dbe55dd0f9169ca5f6,"The quality of any goods, services, information, or other material that may be offered and subsequently purchased  or obtained by through Primal will meet your expectations, or that any errors in the Services will be corrected. You acknowledge and agree that any material downloaded or otherwise obtained through the use of the Services is accessed at your own discretion and risk, and you will be solely responsible for any damage to your computer system or loss of data that results from the download of any such material.",['as-is and as-available'],0,0,0,0,0,0,0,0.0,1.0,
263,5e94e5dbe55dd0f9169ca5f7,Primal makes no representations about the content sources and their usage conditions.,['as-is and as-available'],0,0,0,0,0,0,0,0.0,1.0,
264,5e94e5dbe55dd0f9169ca5f8,"No advice or information, whether oral or written, obtained by you from Primal or through or from the Services shall create any warranty not expressly stated in the Terms of Use.","['as-is and as-available', 'liability']",0,0,0,0,0,0,0,1.0,1.0,I831094
265,5e94e5dbe55dd0f9169ca5f9,"We’re doing some things that have never been done before. With cutting-edge technology comes uncertainty, so we can’t promise or guarantee any particular service or product experience.",['as-is and as-available'],0,0,0,0,0,0,0,1.0,1.0,I831094
266,5e94e5dbe55dd0f9169ca5fa,"You expressly understand and agree that Primal and its subsidiaries, affiliates, officers, employees, agents, partners, and licensors shall not be liable to you for any direct, indirect, incidental, special, consequential, or exemplary damages, whether in contract or tort or otherwise, including but not limited to, damages for loss of profits, goodwill, use, user content, data, or other intangible losses (even if Primal has been advised of the possibility of such damages), resulting from:","['as-is and as-available', 'indemnification']",0,0,0,0,0,0,0,1.0,1.0,I831094
267,5e94e5dbe55dd0f9169ca5fb,"Notwithstanding anything to the contrary in these Terms of Use, Primal’s total liability to you for any reason (whether based in contract, tort, including negligence and strict liability) in connection with these Terms of Use or the Services shall in no event exceed the amount paid by you to Primal prior to the event giving rise to liability.",['indemnification'],0,0,0,0,0,0,0,0.0,1.0,
268,5e94e5dbe55dd0f9169ca5fc,"We want you to use our services, but at the end of the day you must understand you do so at your own risk. Primal’s isn’t liable for your losses from the use of our services.","['as-is and as-available', 'indemnification']",0,0,0,0,0,0,0,0.0,1.0,
269,5e94e5dbe55dd0f9169ca5fd,"Complete Agreement: These most recent listing of these Terms of Use (which do not include the “Terms in Plain English”) and the Privacy Policy constitute the entire agreement between Primal and you pertaining to your use of the Services and, except as specifically set forth herein, supersede any prior agreements between you and Primal relating to the Services.",['general requirements'],1,0,0,0,0,0,0,1.0,1.0,I831094
270,5e94e5dbe55dd0f9169ca5fe,"Motime operates under the “Waala” brand name in certain regions. The terms of this agreement apply to Partners of both the Motime and Waala brand. Any references to Motime shall be interpreted to apply to Waala as well. Although we will use terms such as “Partner”, “you” or “your” to refer to the individual or business entity identified in the Application you submit, you are and remain, for all purposes, purely an independent contractor, responsible for your own actions, taxes, the provision of any benefits, insurance and compliance with any and all laws and regulations that apply to you, your business and activities. Neither this API Agreement, nor your participation in our Self-Serve Partner Program contemplates any sharing of profits or losses, a joint venture or any other form of business arrangement, other than your participation in our Self-Serve Partner Program as described in this API Agreement.",['general requirements'],1,0,0,0,0,0,0,1.0,1.0,I831094
271,5e94e5dbe55dd0f9169ca5ff,"a)   Motime shall, at its own cost and expense, provide Motime Services and Mobile Content for the Motime Service. Motime shall be responsible for and will solely control the Motime Service, including, without limitation, all features, content, pricing and functionality, and has the unrestricted right to modify, suspend or amend same at all times, in its sole discretion.","['changes to service', 'changes to terms', 'change to the product']",0,0,0,0,0,0,0,1.0,1.0,I831094
272,5e94e5dbe55dd0f9169ca600,c)    In no event shall Motime be liable for any breach by any Customer of the Terms & Conditions or any other agreement by which any Customer may be bound.,"['liability', 'indemnification']",0,0,0,0,0,0,0,1.0,1.0,I831094
273,5e94e5dbe55dd0f9169ca601,"b)   Partner shall at all times comply with the terms of Motime’s Marketing Regulations, as may be updated from time to time in Motime’s sole discretion, and which can be found at http://access.motime.com/partner_policy/ and is incorporated herein by reference. Partner shall not display the Integration on any Partner Site, Partner Application or other location directly or indirectly owned or controlled by Partner with or adjacent to any illegal, offensive, pornographic, obscene, violent, hate-related, controversial or otherwise objectionable material.  Without limiting Motime’s other rights or remedies at law or equity, Motime may immediately terminate the API Agreement, withhold payment from you, and disable any Integration hereunder in the event Motime reasonably believes you have failed to comply with the Marketing Regulations.","['obligations', 'termination/suspension']",0,0,0,0,0,0,0,0.0,1.0,
274,5e94e5dbe55dd0f9169ca602,"d)   Partner shall be solely responsible, at no cost to Motime, for (i) procuring and maintaining all necessary rights, consents, licenses, permissions, and clearances with respect to any Partner Sites, Partner Applications, or Partner’s Marks.  Partner shall be solely responsible for any and all royalties and other fees and payments required by any rights holders and licensors of content publicly performed on or made available on or through the Partner Sites and/or Partner Applications (including, without limitation, residuals or other payments to guilds or unions, for music clearances, Internet or wireless streaming, performance, synchronization  and mechanical rights) and all other fees, royalties, charges, payments or obligations arising out of the activities contemplated by this API Agreement) and Motime shall have no responsibility or liability for same whatsoever.","['obligations', 'publication risk']",0,0,0,0,0,0,0,0.0,1.0,
275,5e94e5dbe55dd0f9169ca603,"f)     Partner shall implement the Integration in accordance with the Specifications. Partner shall use reasonable efforts to promptly report to Motime any malfunctions, defects or non-conformities in or affecting the Integration or the Motime Services and take all actions reasonably required to restore the Integration and/or the Motime Services to proper functioning and operation. Motime reserves the right, at its option and without liability, to require Partner to remove or modify Integration, at any time, in any and/or all locations and instances.","['obligations', 'technical requirements']",0,1,0,1,0,0,0,1.0,1.0,I831094
276,5e94e5dbe55dd0f9169ca604,"b)   Motime shall exclusively own all right, title and interest in and to Customer Data collected with respect to Customers, including, without limitation, Customers who access the Integration, as and if applicable. Partner shall not, directly or indirectly, disclose, process or use or authorize, enable, encourage or permit any third party to disclosure, collect, retain or use any Customer Data.",['privacy/data protection'],0,0,0,0,0,0,0,0.0,1.0,
277,5e94e5dbe55dd0f9169ca605,"c)    Except as otherwise expressly provided herein, each party is responsible for all costs and expenses incurred by it in connection with the performance of its obligations under this API Agreement.",['payment'],0,0,0,0,1,0,0,1.0,1.0,I831094
278,5e94e5dbe55dd0f9169ca606,a)   Payments. Motime will pay the commission agreed upon at the time of the Affiliate's registration on Motime Open Access. Motime reserves the right to change its level of commission from time to time at Motime's sole discretion.,"['payment', 'changes to terms']",0,0,0,0,1,0,0,1.0,1.0,I831094
279,5e94e5dbe55dd0f9169ca607,"Should you have questions regarding the commission level, please contact us at http://access.motime.com/help/contactus","['payment', 'contact information']",0,0,0,0,1,0,1,1.0,1.0,I831094
280,5e94e5dbe55dd0f9169ca608,"b)   Within sixty (60) days after the end of each calendar month, Motime shall pay Partner all undisputed Payments due Partner for that calendar month, unless the payment is less than $250 in which case Payment will be aggregated with the following months until at least $250 is reached. No other payments or fees shall be due or payable by Motime to Partner or any other party under or as a result of this API Agreement. Payments by Motime will be accompanied by a report, in reasonable detail, providing the basis for the Payment.",['payment'],0,0,0,0,1,0,0,1.0,1.0,I871655
